{
  "lessonId": "L1_open_raise_position_6max",
  "title": "Stop Bleeding: RFI Discipline by Position",
  "version": 1,
  "moduleCode": "MODULE_A",
  "recommendedOrder": 1,
  "targetAudience": "serious online players moving up stakes",
  "difficulty": "BEGINNER",
  "estimatedMinutes": 8,
  "steps": [
    {
      "id": "L1_step_intro",
      "sequence": 1,
      "type": "INFO_STEP",
      "snapshotVersion": 1,
      "snapshotPath": "../_shared/snapshots/action_preflop_hero_to_act.json",
      "gradingVersion": 1,
      "beforeInstructorMessage": "Most players moving up stakes bleed EV from preflop autopilot.",
      "question": "In early position, what does your open range need to protect against?",
      "followUpInstructorMessage": "Tighter EP opens preserve edge against stronger continue ranges.",
      "gradingSpecJson": {
        "type": "INFO_STEP",
        "response": "Position controls realization pressure."
      }
    },
    {
      "id": "L1_step_action",
      "sequence": 2,
      "type": "ACTION_STEP",
      "snapshotVersion": 1,
      "snapshotPath": "../_shared/snapshots/action_preflop_hero_to_act.json",
      "gradingVersion": 1,
      "beforeInstructorMessage": "Take the highest-EV preflop baseline line.",
      "question": "Use the ActionBar and choose your response.",
      "followUpInstructorMessage": "Small preflop mistakes in high-frequency nodes create large monthly EV drag.",
      "gradingSpecJson": {
        "type": "ACTION_STEP",
        "expectedAction": "RAISE",
        "responseCorrect": "Correct. This line captures value and initiative.",
        "responseIncorrect": "Not ideal. This node prefers the value-aggressive baseline.",
        "followUpCorrect": "Good. This protects your preflop edge.",
        "followUpIncorrect": "Revisit position and realization tradeoffs.",
        "runtime": {
          "scenarioProviderKey": "static_snapshot",
          "evaluatorKey": "action_rubric_eval",
          "revealLayerKeys": ["ev_impact"],
          "continuationKey": null,
          "displayCategory": "WWYD_COMPARE"
        }
      },
      "scenarioProviderKey": "static_snapshot",
      "evaluatorKey": "action_rubric_eval",
      "revealLayerKeys": ["ev_impact"],
      "continuationKey": null,
      "displayCategory": "WWYD_COMPARE"
    }
  ]
}
